<!ELEMENT default-size (for-stereotype|for-type)+>

<!ELEMENT for-stereotype EMPTY>
<!ATTLIST for-stereotype
 name CDATA #REQUIRED
 size CDATA #REQUIRED
>

<!ELEMENT for-type EMPTY>
<!ATTLIST for-type
 class CDATA #REQUIRED
 size CDATA #REQUIRED
>
